question_num,type,utterance,page,targetValue,csv_file,Answer
4179,3,what is the difference between marcellino lucchi's points and max biaggi's points?,35,5,203,A7: 5 points difference (25.0 - 20.0 = 5.0)
5966,3,how many riders in the top 15 were riding a honda?,35,9,203,"A8: 9 riders (Ralf Waldmann, Olivier Jacque, Jürgen Fuchs, Jean-Philippe Ruggia, Nobuatsu Aoki, Luis d'Antin, Cristiano Migliorati, Regis Laconi, Jurgen van den Goorbergh)"
6884,3,does olivier jacque have the same time as tetsuya harada?,35,No,203,"A9: No, Olivier Jacque's time was +18.607, Tetsuya Harada's time was +31.649."
7769,3,what is the number of italian riders that placed in the top 10?,35,3,203,"A10: 3 Italian riders (Max Biaggi, Marcellino Lucchi, Cristiano Migliorati)"
7867,1,what manufacturer is listed for max biaggi and marcellino lucchi?,35,Aprilia,203,A11: Aprilia
25,3,what's the number of parishes founded in the 1800s?,36,4,203,"Q1: 3 parishes (St Mary's in Bacup, Our Immaculate Mother & St Anselm in Whitworth, The Immaculate Conception in Haslingden)."
2147,3,how many parishes were founded before 1900?,36,4,203,"Q2: 4 parishes (St Mary's in Bacup, Our Immaculate Mother & St Anselm in Whitworth, The Immaculate Conception in Haslingden, St James the Less in Rawtenstall)."
2237,2,how many parishes had fr frank thorpe as their parish priest?,36,2,203,"Q3: 2 parishes (St Mary's in Bacup, Our Immaculate Mother & St Anselm in Whitworth)."
4973,1,name a parish that no parish priest is listed.,36,St Joseph,203,Q4: St Joseph in Stacksteads.
9387,1,"other than st mary, which parish was founded by fr frank thorpe?",36,Our Immaculate Mother & St Anselm,203,Q5: Our Immaculate Mother & St Anselm in Whitworth.
10905,1,which parish was founded after 1950?,36,St Veronica (Chapel of Ease),203,Q6: St Veronica (Chapel of Ease) in Helmshore.
11741,2,which parish is the only one to have closed?,36,St Joseph,203,Q7: St Joseph in Stacksteads.
13965,3,which parish was founded earlier between st. joseph and st james the less?,36,St James the Less,203,Q8: St James the Less in Rawtenstall (founded in 1828) was founded earlier than St Joseph in Stacksteads (founded in 1947).
770,2,which school was in the columbus neighborhood and was demolished?,40,School 73,203,Q1: School 73 was in the Columbus neighborhood and was demolished.
1597,3,how many schools were turned into private apartments?,40,3,203,Q2: Three schools were turned into private apartments:   - School 16   - School 22  - School 13
6126,3,how many schools are vacant?,40,16,203,Q3: The schools that are currently vacant are:   - School 8   - School 11  - School 18   - School 26   - School 39   - School 49   - School 75   - School 77  - School 2 (Harbor Heights Elementary School)
10769,3,what is the total number of schools that are now vacant?,40,16,203,Q4: Nine schools are currently vacant.
12354,1,which school is the first school to have been closed?,40,School 35,203,"Q5: School 14, which was closed in the 1930s, is the first school to have been closed."
12831,3,what is the total number of schools that were demolished?,40,24,203,Q6: A total of 21 schools were demolished:
4874,1,which route had plain stage terrain and was used on the 27th of june?,44,Freiburg - Besançon,203,"A1: The route used on the 27th of June with plain stage terrain was from Freiburg to Besançon, covering 200 km (120 mi)."
10036,3,how many different countries won at least one stage in the 1964 tour de france?,44,5,203,"A2: Five different countries won at least one stage in the 1964 Tour de France. These countries were Belgium, France, Netherlands, Spain, and Germany."
2367,3,"how many television channels in nambour, queensland are in hd?",51,4,203,"Q1: 5 television channels in Nambour, Queensland are in HD."
4625,3,what is the definition of the last channel?,51,SD,203,Q2: The definition of the last channel (Index 3 - ABC News 24) is high definition (HD).
4871,3,what number of organisations have private ownership?,51,10,203,Q3: 4 organizations have private ownership.
4923,3,how many private owned channels are there?,51,10,203,Q4: 8 channels are privately owned.
5703,3,how many channels are in hd?,51,4,203,Q5: 5 channels are in HD.
7964,2,"which organization has more television channels in nambour, queensland, nine network or australian broadcasting commission?",51,Australian Broadcasting Corporation,203,"Q6: The Australian Broadcasting Commission has more television channels (4 channels) in Nambour, Queensland than the Nine Network (3 channels)."
8024,3,how many channels are not an abc channel?,51,12,203,Q7: 11 channels are not ABC channels.
9226,3,what are the number of channels owned by the government?,51,6,203,Q8: 6 channels are owned by the government.
11344,3,whats is the number of channel's that broadcast in hd?,51,4,203,Q9: 5 channels broadcast in HD.
11479,3,"which television channels in nambour, queensland are owned by the same organization as abc1?",51,ABC2|ABC3|ABC News 24,203,"Q10: The television channels in Nambour, Queensland owned by the same organization as ABC1 are ABC2, ABC3, and ABC News 24."
2836,3,how many laps total were completed by all drivers?,52,1144,203,Q1: The total laps completed by all drivers is 886 laps (calculated by summing the laps completed by each driver).
3488,3,how many total laps were there in the 2008 canadian grand prix?,52,70,203,Q2: The total number of laps in the 2008 Canadian Grand Prix was 70 laps.
4298,3,who placed first in the 2008 canadian grand prix?,52,Robert Kubica,203,Q3: Robert Kubica placed first in the 2008 Canadian Grand Prix.
5613,3,what is the number of drivers that finished the 2008 canadian grand prix before jarno trulli?,52,5,203,Q4: Five drivers finished the 2008 Canadian Grand Prix before Jarno Trulli.
6798,3,who had the fastest lap time?,52,Robert Kubica,203,Q5: The information given does not include data about the fastest lap time.
7106,3,who finished after nico rosberg?,52,Jenson Button,203,Q6: Mark Webber finished after Nico Rosberg.
8077,3,adrian sutil had to retire before which driver?,52,Lewis Hamilton,203,Q7: Adrian Sutil had to retire before Kimi Räikkönen.
8576,1,who was the last driver listed to receive points?,52,Sebastian Vettel,203,Q8: Rubens Barrichello was the last driver listed to receive points.
8704,3,"of all the retired drivers, which of them completed the least amount of laps?",52,Adrian Sutil,203,"Q9: Adrian Sutil completed the least amount of laps among all retired drivers, with 13 laps."
10114,3,which country did most drivers represent?,52,Germany,203,Q10: The information provided does not specify the country of each driver.
13137,3,how long did robert kubica take to complete the race?,52,1:36:24.227,203,"Q11: Robert Kubica took 1 hour, 36 minutes, and 24.227 seconds to complete the race."
13520,3,how many drivers completed at least 45 laps?,52,15,203,Q12: 14 drivers completed at least 45 laps.
13854,3,how many cars spun off the track?,52,2,203,Q13: Two cars spun off the track (Fernando Alonso and Giancarlo Fisichella).
227,3,when was the last super chinese game released?,55,1999,203,A1: The last Super Chinese game released was Super Chinese Fighter EX in 1999.
1797,3,"of the titles released in north america, which had the least releases?",55,Super Chinese World,203,"A2: The titles released in North America, namely ""Kung-Fu Heroes"", ""Little Ninja Brothers"", ""Ninja Boy"", and ""Super Ninja Boy"", each had one release."
3966,3,what are the total of super chinese games released?,55,13,203,A3: There are a total of 13 Super Chinese games released.
5472,1,number of super chinese world games released,55,3,203,A4: There were 3 Super Chinese World games released.
7262,3,the first year a game was released in north america,55,1986,203,A5: The first year a Super Chinese game was released in North America was 1986 (Kung-Fu Heroes).
8739,3,how many action games were released in north america?,55,2,203,"A6: Two action games were released in North America: ""Kung-Fu Heroes"" and ""Ninja Boy""."
13316,3,which platforms had the most titles released?,55,GB,203,"A7: The Game Boy and Super Famicom/Super NES platforms had the most titles released, each hosting 4 titles."
332,3,how many stars have a magnitude greater than zero?,56,14,203,A1: Eight stars have a magnitude greater than zero currently:   - Epsilon Canis Majoris: 1.5   - Beta Canis Majoris: 1.99   - Capella: 0.08   - Beta Aurigae: 1.9   - Zeta Leporis: 3.55   - Upsilon Librae: 3.6   - Zeta Sagittarii: 2.6   - Vega: 0.03
1883,3,how many stars have a current magnitude of at least 1.0?,56,11,203,A2: Six stars have a current magnitude of at least 1.0:   - Epsilon Canis Majoris: 1.5  - Beta Canis Majoris: 1.99   - Beta Aurigae: 1.9 - Zeta Leporis: 3.55   - Upsilon Librae: 3.6   - Zeta Sagittarii: 2.6
1939,3,how much farther (in ly) is epsilon canis majoris than zeta sagittarii?,56,26,203,A3: The difference in distance between Epsilon Canis Majoris (430.0 ly) and Zeta Sagittarii (89.1 ly) is 430.0 - 89.1 = 340.9 light years.
7830,3,how many stars have a distance at maximum of 30 light years or higher?,56,9,203,A4: Thirteen stars have a distance at maximum of 30 light years or higher:
8961,3,is capella's current magnitude more than vega's current magnitude?,56,Yes,203,"A5: Yes, Capella's current magnitude (0.08) is more than Vega's current magnitude (0.03)."
9313,3,what is the difference in the nearest current distance and farthest current distance?,56,491.4,203,A6: The difference in the nearest current distance (Sirius: 8.6 ly) and farthest current distance (Beta Canis Majoris: 500.0 ly) is 500.0 - 8.6 = 491.4 light years.
10860,3,how many stars do not have a current magnitude greater than zero?,56,5,203,A7: Eleven stars do not have a current magnitude greater than zero (they are zero or negative):
11053,3,which star has the highest distance at maximum?,56,Canopus (fourth time),203,A8: Beta Cygni has the highest distance at maximum of the listed entries at 80.0 light years.
12149,1,what is the only star with a distance at maximum of 80?,56,Beta Cygni,203,A9: Beta Cygni is the only star with a distance at maximum of 80 light years.
13956,3,what is the number of stars that have a maximum magnitude less than zero?,56,5,203,A10: All eighteen entries listed have a maximum magnitude less than zero.
6322,3,"based on the table of brazil's results at the fifa world cup between 1930 and 2010, in which listed year did brazil play on average only a single match in round 1?",57,1934,203,A1: 1930 - Brazil played only two matches in the group round in 1930.
9639,3,how many goals did brazil score in the 1950 world cup?,57,22,203,A2: Brazil scored 22 goals in the 1950 World Cup.
9707,3,largest victory,57,7-1,203,"A3: The largest victory was against Sweden in the 1950 World Cup, where Brazil won 7-1."
10189,3,"based on the table of brazil's results at the fifa world cup between 1930 and 2010, in which year did brazil's player romeu score a point in brazil's bronze final match against sweden after previously scoring a point in the semi-final match against italy?",57,1938,203,A4: 1938 - Romeu scored in both the Semi-Final against Italy and the Bronze Final against Sweden in 1938.
10253,3,the most goals scored in a game,57,11,203,A5: The most goals scored in a game by Brazil was 7 goals against Sweden in the 1950 World Cup (7-1 victory).
11170,3,"based on the table of brazil's results at the fifa world cup between 1930 and 2010, in which year did teams score no match points at all during the final between brazil and italy?",57,1994,203,"A6: 1994 - The final between Brazil and Italy in the 1994 World Cup ended 0-0 after extra time, with no goals scored during the match (Brazil won 3-2 on penalties)."
460,1,"according to usgs estimates of mine production, what was the total estimated mine production of niobium minerals from the nation of brazil in 2006?",59,"40,000",203,"A1: The total estimated mine production of niobium minerals from Brazil in 2006 was 40,000 tons."
3167,1,what is the total amount of niobium produced in rwanda in 2000?,59,28,203,A2: There is no data provided on the niobium production in Rwanda for the year 2000.
3382,3,"which countries did not produce more than 1,000 in the year 2006?",59,Australia|Mozambique|Nigeria|Rwanda,203,"A3: Based on the data provided, Australia did not produce more than 1,000 in the year 2006. The value for Australia was given as 200 for 2006."
4017,3,after brazil which country produced the most niobium?,59,Canada,203,A4: The country that produced the most niobium after Brazil is not specified in the data provided.
4897,1,which country produced 50 in 2002 but only 13 in 2003?,59,Congo D.R.,203,A5: There is no information provided about a country that produced 50 in 2002 and 13 in 2003.
6085,2,what country was the top producer of niobium in the year 2003?,59,Brazil,203,"A6: Brazil was the top producer of niobium in the year 2003 with a production of 29,000 tons."
10106,1,"according to usgs estimates of mine production, which nation in 2005 produced a larger quantity of niobium mineral production, nigeria or rwanda?",59,Rwanda,203,"A7: The data does not provide specific figures for either Nigeria or Rwanda in 2005, so a comparison cannot be made."
10236,2,a total of how many (t) of niobium was produced in the world in the year 2000?,59,"32,600",203,A8: There is no total world production figure given for niobium in the year 2000.
12446,2,besides australia which other countries produced more than 100 in the year 2000?,59,Brazil|Canada,203,A9: There is no information provided on countries besides Australia that produced more than 100 in the year 2000.
13132,2,"in 2000, did world mine production according to usgs estimates produce more tons or less tons of output of niobium minerals than in 2002, when a total of 29,900 tons was estimated to have been mined?",59,more,203,"A10: The question cannot be directly answered with the provided data, as there is no total figure for world mine production in 2000 to compare against the 29,900 tons in 2002."
138,2,in which country did thierry tulasne win his last singles title?,60,Switzerland,203,A1: France
709,2,"what are the total games won against claudio pannata on june 10,1985 in bologna,italy?",60,1,203,A2: 12 games (6+6)
1658,3,what is thierry tulasne number of clay court titles?,60,4,203,A3: 5 clay court titles
2870,3,how many tournaments were played indoor?,60,1,203,A4: 1 tournament played indoor
3676,3,how many singles finals did thierry tulasne win against swedish opponents?,60,3,203,A5: 2 finals won against Swedish opponents
4019,3,who was the opponent in the last tournament?,60,Henri Leconte,203,A6: Henri Leconte
4239,3,what were the total number of times the championship was held in italy?,60,2,203,A7: 2 championships held in Italy
5643,2,in which country did thierry tulasne win 2 consecutive titles in 1985,60,Italy,203,A8: Spain
5744,3,who is the only player to be listed twice as an opponent in the finals?,60,Andrés Gómez,203,A9: Andrés Gómez
6299,3,which surface was used the least?,60,Indoor,203,A10: Indoor surface
8053,3,how many were played before 1985?,60,2,203,A11: 3 tournaments played before 1985
8274,3,how many indoor titles did therry tulasnewin?,60,1,203,A12: 1 indoor title
9168,3,which month were the most championships played?,60,September,203,A13: September (3 championships)
11656,3,how many atp tour titles did thierry tulasne win?,60,5,203,A14: 5 ATP tour titles
993,3,"nigeria has the most gold medals, but who has the most medals overall?",61,South Africa,203,A1: South Africa has the most medals overall with 30 medals.
1587,1,the total number of medals won by south africa was how many?,61,30,203,A2: South Africa won a total of 30 medals.
4765,2,how many gold medals has kenya won?,61,5,203,A3: Kenya won 5 gold medals.
4929,1,"which african country had 8 silver medal wins, but no gold medals?",61,Algeria,203,A4: Algeria had 8 silver medals but no gold medals.
5306,3,what is the difference of silver medals between south africa and kenya?,61,7,203,"A5: South Africa won 7 more silver medals than Kenya (South Africa 11, Kenya 4)."
6227,1,which african country had more total medal wins then nigeria?,61,South Africa,203,"A6: South Africa won more total medals than Nigeria (South Africa 30, Nigeria 24)."
7391,3,which nation won the same amount og golds as ghana?,61,Senegal|Tunisia,203,A7: Senegal and Ghana each won 2 gold medals.
7391,3,which nation won the same amount og golds as ghana?,61,Senegal|Tunisia,203,A8: Senegal and Ghana each won 2 gold medals.
7813,3,which nation won more gold medals than south africa?,61,Nigeria,203,"A9: Nigeria won more gold medals than South Africa (Nigeria 13, South Africa 11)."
11006,3,what was the total number of medals won by madagascar?,61,3,203,A10: Madagascar won a total of 3 medals.
11794,3,which nation won the most gold medals?,61,Nigeria,203,A11: Nigeria won the most gold medals with 13.
12394,3,how many gold medals did the ivory coast and namibia win combined?,61,0,203,A12: Ivory Coast and Namibia won 0 gold medals combined.
12786,1,"which 4 countries were scored last, with only 1 bronze medal each?",61,Central African Republic|Uganda|Namibia|Ivory Coast,203,"A13: Central African Republic, Uganda, Namibia, and Ivory Coast each won only 1 bronze medal."
13778,1,which country was ranked as the top in the 1999 all-africa games?,61,Nigeria,203,A14: Nigeria was ranked as the top nation in the 1999 All-Africa Games.
294,1,what is difference in points between c.d. aguila and chalatenango?,67,14,203,A1: The difference in points between C.D. Águila and Chalatenango is 14 points (31 - 17).
921,3,what is the difference between the number of goals scored from the highest scoring team and the lowest scoring team?,67,25,203,A2: The difference between the number of goals scored by the highest scoring team (C.D. Águila with 38 goals) and the lowest scoring team (Chalatenango with 13 goals) is 25 goals.
2906,1,besides c.d. arcense which other team has 17 points?,67,Chalatenango,203,"A3: Chalatenango is the other team with 17 points, besides C.D. Arcense."
5191,3,how many games were played?,67,180,203,"A4: A total of 180 games were played, assuming each of the 10 teams played 18 matches."
5608,3,which team scored the most points?,67,C.D. FAS,203,A5: The team that scored the most points is C.D. FAS with 36 points.
5697,3,which team conceded the least goals?,67,C.D. FAS,203,A6: The team that conceded the least goals is C.D. FAS with 13 goals conceded.
5784,1,which team earned more than 30 points besides c.d. fas?,67,C.D. Águila,203,A7: No other team earned more than 30 points besides C.D. FAS; the next closest is C.D. Águila with 31 points.
6512,3,which team scored the most goals?,67,C.D. Águila,203,A8: The team that scored the most goals is C.D. Águila with 38 goals.
7473,3,how many points did alianza f.c. receive?,67,28,203,A9: Alianza F.C. received 28 points.
10360,3,who was the top team of the apertura 2003 standings?,67,C.D. FAS,203,A10: The top team of the Apertura 2003 standings is C.D. FAS.
12579,3,what two teams ended the season with the same record of wins/loses/draws?,67,San Salvador F.C.|Alianza F.C.,203,"A11: No two teams ended the season with exactly the same record of wins, losses, and draws."
14141,3,which team earned the least amount of points in the apertura 2003 standings?,67,C.D. Atlético Balboa,203,A12: The team that earned the least amount of points in the Apertura 2003 standings is C.D. Atlético Balboa with 15 points.
5009,3,who was the first ambassador the united states has sent to mexico?,69,William Shaler,203,"Q1: The first ambassador the United States sent to Mexico was William Shaler, who served as the Special Diplomatic Agent from 1810 to 1812."
5277,3,how many years has does this table cover?,69,88,203,"Q2: This table covers the years from 1810 to 1898, totaling 88 years."
8514,3,what is the total number of representatives?,69,50,203,Q3: The total number of representatives listed is 50.
8875,3,at least what number of people have the title minister,69,26,203,Q4: At least 19 people have held the title of Minister.
9542,3,who was the last person appointed on this table?,69,Powell Clayton,203,"Q5: The last person appointed on this table was Powell Clayton, who served as the Minister from 1897 to 1898."
11468,3,which united states president appointed the most ambassador's to mexico,69,James Buchanan,203,"Q6: James Buchanan appointed the most ambassadors to Mexico, with at least 6 appointees."
12655,3,count the number of special diplomatic agents and give that number.,69,22,203,Q7: There are 17 Special Diplomatic Agents listed in the table.
876,3,how many nations won at least 10 medals?,70,8,203,"A1: 4 nations won at least 10 medals (France, Romania, Canada, and Quebec)."
1212,1,how many more medals did egypt win than ivory coast?,70,5,203,A2: Egypt won 5 more medals than Ivory Coast (11 medals for Egypt vs. 6 medals for Ivory Coast).
2062,1,how many bronze medals does togo have?,70,1,203,A3: Togo has 1 bronze medal.
10467,1,what was the total medal count of switzerland?,70,8,203,A4: Switzerland's total medal count is 8 medals.
10732,3,how many counties have at least one silver medal?,70,18,203,A5: 14 countries have at least one silver medal.
10744,1,what is the difference between france's and egypt's silver medals?,70,23,203,A6: The difference between France's and Egypt's silver medals is 23 (28 silver medals for France vs. 5 silver medals for Egypt).
12554,3,who placed in first according to medals?,70,France,203,A7: France placed first according to total medals won.
1329,2,yes or no: dundee is ranked in the top third of this for population.,74,No,203,Q1: No
1392,3,which urban area has the least people per square kilometer?,74,Livingston,203,Q2: Livingston
2645,1,what is the total area of edinburg?,74,120.11,203,Q3: 120.11 km²
5805,3,"how many urban areas have a density below 2,500?",74,1,203,Q4: One
7983,3,which urban area ranks first in population density?,74,Edinburgh,203,Q5: Edinburgh
8811,3,"which has a higher population density, greater glasgow or falkirk?",74,Greater Glasgow,203,Q6: Greater Glasgow
9268,1,which urban area is ranked first overall?,74,Greater Glasgow,203,Q7: Greater Glasgow
11064,3,"how many urban areas have a population above 90,000?",74,5,203,Q8: Four
11199,3,which urban area has the largest population?,74,Greater Glasgow,203,Q9: Greater Glasgow
881,1,which driver has the least amount of points?,76,Ralf Schumacher,203,"Q1: Patrick Friesacher, Narain Karthikeyan, Jarno Trulli, Felipe Massa, Nick Heidfeld, David Coulthard, Jacques Villeneuve, Takuma Sato, Christian Klien, Christijan Albers, Mark Webber, and Tiago Monteiro all scored 0 points."
1386,3,"which driver in the top 8, drives a mclaran-mercedes but is not in first place?",76,Kimi Räikkönen,203,Q2: Kimi Räikkönen drives a McLaren-Mercedes and finished 3rd.
1427,1,is there a points difference between the 9th position and 19th position on the list?,76,No,203,"Q3: Yes, there is a points difference as the 9th position (Jarno Trulli) did not earn points, whereas positions in the top 8 did earn points."
4849,3,how many drivers received points from the race?,76,8,203,Q4: 8 drivers received points from the race.
5512,3,how many drivers from germany?,76,3,203,"Q5: There are 3 drivers from Germany: Michael Schumacher, Nick Heidfeld, and Ralf Schumacher."
6176,3,what is the number of toyota's on the list?,76,4,203,Q6: There are 2 Toyotas on the list: driven by Ralf Schumacher and Jarno Trulli.
11191,2,which driver has his grid at 2?,76,Jenson Button,203,Q7: Jenson Button started from the 2nd position on the grid.
11391,3,"after 8th position, how many points does a driver receive?",76,0,203,"Q8: After the 8th position, a driver receives 0 points."
12221,3,which driver came after giancarlo fisichella?,76,Jenson Button,203,Q9: Rubens Barrichello came after Giancarlo Fisichella in the race results.
391,3,which album was the least acclaimed but did reach the billboard 200?,77,i,203,"A1: The album ""i"" was the least acclaimed but did reach the Billboard 200, charting at #152."
2502,1,which album by the magnetic fields reached higher than 100 on the billboard chart?,77,Distortion|Love at the Bottom of the Sea,203,"A2: The albums ""Distortion"" and ""Love at the Bottom of the Sea"" both reached higher than 100 on the Billboard chart."
3722,1,was distortion or love at the bottom of the sea the highest rated album?,77,Distortion,203,"A3: ""Distortion"" was the highest rated album between the two, reaching #77 on the Billboard 200."
4815,3,what is the total number of albus from this chart that made the billboard 200?,77,4,203,A4: Four albums from this chart made the Billboard 200.
6936,3,what was the earliest released album?,77,Distant Plastic Trees,203,"A5: The earliest released album was ""Distant Plastic Trees"" in 1991."
7561,3,how many years after 1999 did merge records release their next album?,77,5,203,"A6: Merge Records released their next album in 1994, which is 5 years after 1999."
9072,3,what album title came next after get lost?,77,69 Love Songs,203,"A7: The album title that came next after ""Get Lost"" is ""69 Love Songs."""
12048,1,realism and i were above or below number 100 on the billboard 200?,77,Below,203,"A8: Both ""Realism"" and ""i"" were below number 100 on the Billboard 200."
398,3,which company has the least number of employees?,83,Vitol,203,"Q1: The company with the least number of employees is Vitol, with 2,800 employees."
1365,3,what company has the top revenue?,83,"Wal-Mart Stores, Inc.",203,"Q2: The company with the top revenue is Wal-Mart Stores, Inc., with $469 billion."
2242,1,who earned the same revenue as hon hai precision industry?,83,Ford Motor Company,203,"Q3: The information about Hon Hai Precision Industry's revenue is not provided, so a comparison cannot be made."
