question_num,type,utterance,page,targetValue,csv_file,Answer
3427,1,how many employees does vitol have?,83,"2,800",203,"Q4: Vitol has 2,800 employees."
3718,3,how many oil and gas industries made the top 10 in ranking of revenue list?,83,6,203,"Q5: Three oil and gas industries made the top 10 in the ranking of revenue list: Royal Dutch Shell, Sinopec Group, and BP."
4348,3,what is the company with the highest revenue in the automotive industry?,83,Volkswagen Group,203,"Q6: The company with the highest revenue in the automotive industry is Toyota, with $222 billion."
6984,3,how many companies have at least 200 billion in revenue for oil and gas?,83,8,203,"Q7: Six oil and gas companies have at least $200 billion in revenue: Royal Dutch Shell ($467 billion), Sinopec Group ($411 billion), BP ($379 billion), ExxonMobil (not specifically listed in the provided data but typically above $200 billion), China National Petroleum Corporation ($425 billion), and Saudi Aramco ($311 billion)."
10039,3,which company is ranked at the top with the largest revenue?,83,"Wal-Mart Stores, Inc.",203,"Q8: Wal-Mart Stores, Inc. is ranked at the top with the largest revenue."
11825,3,what company is ranked below apple?,83,Japan Post Holdings,203,Q9: The information about Apple's ranking and the company ranked directly below is not provided in the list given.
1772,3,the least amount of females,88,Romanian,203,Q1: 6 (Romanian-speaking females)
3155,3,which language had the least female speakers?,88,Romanian,203,Q2: Romanian
4436,3,which language had the smallest number of females speaking it.,88,Romanian,203,Q3: Romanian
7569,2,is german above or below russia in the number of people who speak that language?,88,below,203,"Q4: Below (Russian speakers are 87,850, German speakers are 77,160)"
9363,2,number of male russian speakers,88,13 551,203,"Q5: 13,551"
10542,3,what was the top language from the one's whose percentage was >0.01,88,Romanian,203,Q6: Russian (4.54% of the total population)
11390,3,what was the next most commonly spoken language in poland after russian?,88,German,203,Q7: Yiddish (16.41% of the total population)
11748,3,what is the highest percentage of speakers other than polish?,88,Yiddish,203,Q8: Yiddish (16.41% of the total population)
11933,3,which language had the most number of people speaking it.,88,Polish,203,"Q9: Polish (1,420,436 speakers)"
973,2,what religious group is the only one with at least 90% literacy %?,90,Jain,203,A1: Jain community.
2630,3,how many of these religious groups have a literacy rate of above 60%?,90,5,203,"A2: Three (Hindus, Christians, Jains)."
3608,1,how long was the timespan in which growth was measured?,90,10 years,203,A3: 10 years (1991 to 2001).
4756,3,what has the least percentage in india?,90,Jain,203,A4: Jain community.
5674,3,the number of religious groups with a sex ratio of more than 1000 is how many?,90,1,203,A5: None (no religious group has a sex ratio of more than 1000).
7163,2,which is the only religious group to have a literacy rate above 90%?,90,Jain,203,A6: Jain community.
7806,3,which religion has the highest percentage represented in india?,90,Hindu,203,A7: Hindu community.
10636,3,how many religious groups have a leteracy rate of 70% at most?,90,3,203,"A8: Two (Hindus, Buddhists)."
12704,3,which religious group has the highest population %?,90,Hindu,203,A9: Hindu community.
769,1,in which olympic games did arasay thondike not finish in the top 20?,91,2012,203,"Q1: Arasay Thondike did not finish in the top 20 at the 2012 Olympic Games held in London, United Kingdom, where she finished 23rd in the qualifiers."
3935,3,does arasay thondike have more/less than 4 1st place tournament finishes?,91,less,203,Q2: Arasay Thondike has more than 4 1st place tournament finishes.
10802,3,how many times was the number one position earned?,91,3,203,Q3: Arasay Thondike earned the number one position 3 times:
13610,3,what is the number of competitions held in cuba?,91,3,203,Q4: The number of competitions held in Cuba is 3:
365,3,which elected successor took office the earliest?,93,Henry E. Prickett,203,"Q1: Peter J. Pefley took office the earliest as an elected successor, in July 1887."
829,3,who was appointed before h.w. whillock?,93,Byron E. Hyatt,203,Q2: S. H. Hays was appointed before H. W. Whillock.
3819,3,"who resigned earlier, james p. pope or h. w. whillock?",93,James P. Pope,203,"Q3: James P. Pope resigned earlier than H. W. Whillock. Pope resigned on February 13, 1933, while Whillock resigned on May 11, 1942."
4087,1,what number of years did john hailey serve?,93,0,203,Q4: John Hailey never took office; he served 0 years.
6081,3,how many never took office?,93,2,203,"Q5: Three people never took office: L. B. Lindsay, John Hailey, and Dirk Kempthorne (though the latter was appointed and resigned on the same day)."
12206,1,who was appointed after dirk kempthorne?,93,H. Brent Coles,203,Q6: H. Brent Coles was appointed after Dirk Kempthorne.
935,1,how many strokes marked the margin of victory for justin rose in 2011?,94,2,203,A1: Justin Rose won by a margin of 2 strokes in 2011.
1025,3,first player to win with a score over 70 for one round?,94,Justin Rose,203,A2: Dustin Johnson was the first to win with a score over 70 in one round (70 in the second round in 2010).
1165,3,besides tiger woods what other player won between 2007 and 2009?,94,Camilo Villegas,203,A3: Camilo Villegas won the BMW Championship in 2008.
1220,3,after justin rose won in 2011 who won next?,94,Rory McIlroy,203,"A4: After Justin Rose won in 2011, Rory McIlroy won next in 2012."
6905,3,what is the total amount of american players that have won the western open since 2007?,94,3,203,"A5: One American player, Dustin Johnson, has won the BMW Championship from 2007 to 2013."
12314,3,which player earned the most between 2007 and 2013 in the western open?,94,Tiger Woods,203,"A6: Tiger Woods earned the most between 2007 and 2013, securing two wins (2007 and 2009)."
12866,3,who was the last winner of the western open(2013)?,94,Zach Johnson,203,A7: The last winner of the BMW Championship in 2013 was Zach Johnson.
13857,1,who won after tiger woods in 2010?,94,Dustin Johnson,203,"A8: After Tiger Woods won in 2009, Dustin Johnson won in 2010."
14072,3,which player won by the least number of strokes?,94,Dustin Johnson,203,"A9: Dustin Johnson won by the least number of strokes, 1 stroke, in 2010."
14074,3,count the number of times the western open has been held at the cog hill golf and country club since 2007.,94,4,203,"A10: The BMW Championship was held at Cog Hill Golf & Country Club four times since 2007 (2007, 2009, 2010, 2011)."
925,1,"in equal sized portions, do potatoes or plantains contain more grams of protein?",97,potatoes,203,A1: The protein content for potatoes and plantains is not provided directly in the given data. Therefore I cannot determine which contains more grams of protein.
1124,3,what food has the highest amount of magnesium?,97,Maize / Corn,203,A2: Maize/Corn has the highest amount of magnesium at 127mg per 100g.
4933,3,what staple has the least amount of fat?,97,Sweet potato,203,A3: The data provided does not include specific fat content for each staple so I cannot determine which has the least amount of fat.
5013,3,which of the major staple foods contains the highest number of grams of carbohydrates in a 100 gram portion?,97,Rice,203,A4: Rice contains the highest number of grams of carbohydrates per 100g portion with 80g.
9207,2,what is the difference in grams of water between 100g of wheat and 100g of rice?,97,1,203,A5: The difference in grams of water between 100g of wheat (13g) and 100g of rice (12g) is 1 gram.
10759,3,how many staples have more than 5 grams of fiber?,97,3,203,A6: Based on the data the staples with more than 5 grams of fiber per 100g are:   - Maize/Corn: 7.3g   - Wheat: 12.2g  - Sorghum: 6.3g   There are 3 staples that meet this criterion.
11091,3,how many staples have at least 1 mg of zinc?,97,3,203,A7: Zinc content is not specified in the provided data so I cannot determine how many staples have at least 1 mg of zinc.
12744,3,what staple has the most potassium?,97,Yam,203,A8: Yam contains the most potassium at 816mg per 100g.
13651,3,at least how many grams of water do the staple foods have?,97,9,203,A9: The lowest amount of water content mentioned for any staple is 9g per 100g found in Sorghum. Therefore at least 9 grams of water is the minimum among the staple foods listed.
1272,3,which morgan creek film grossed the most money prior to 1994?,98,Robin Hood: Prince of Thieves,203,"A1: ""Robin Hood: Prince of Thieves"" grossed the most money prior to 1994 with $390,493,908 worldwide."
1369,3,what is the top grossing film?,98,Robin Hood: Prince of Thieves,203,"A2: ""Robin Hood: Prince of Thieves"" is the top-grossing film with $390,493,908 worldwide."
3293,2,did true romance make more or less money than diabolique?,98,Less,203,"A3: ""True Romance"" made less money than ""Diabolique."" ""True Romance"" grossed $12,281,551, while ""Diabolique"" grossed $17,100,369 worldwide."
4500,1,was the budget for young guns more or less than freejack's budget?,98,less,203,"A4: The budget for ""Young Guns"" was less than ""Freejack's"" budget. ""Young Guns"" had a budget of $11 million, and ""Freejack"" had a budget of $30 million."
4932,3,what movie came out after bad moon?,98,Wild America,203,"A5: The movie that came out after ""Bad Moon"" was ""Diabolique."""
5199,3,what movie was made immediately before the pledge?,98,The In Crowd,203,"A6: The movie made immediately before ""The Pledge"" was ""Angel Eyes."""
6665,3,what was the last movie morgan creek made for a budget under thirty million?,98,Ace Ventura Jr: Pet Detective,203,"A7: ""Diabolique"" was the last movie Morgan Creek made for a budget under thirty million with a budget of $45 million."
7002,1,what was the only movie with a 48 million dollar budget?,98,Robin Hood: Prince of Thieves,203,A8: There is no movie listed with a $48 million budget; it is a typographical error in the question.
7758,3,which morgan creek film grossed the most worldwide?,98,Robin Hood: Prince of Thieves,203,"A9: ""Robin Hood: Prince of Thieves"" grossed the most worldwide with $390,493,908."
8248,2,"which film had a higher budget, ace ventura: when nature calls, or major league: back to the minors?",98,Ace Ventura: When Nature Calls,203,"A10: ""Ace Ventura: When Nature Calls"" had a higher budget than ""Major League: Back to the Minors."" ""Ace Ventura: When Nature Calls"" had a budget of $30 million, whereas ""Major League: Back to the Minors"" is not listed with a budget, suggesting a lower profile production."
9426,3,how many films were there in 1990?,98,5,203,"A11: There were four films in 1990: ""Coupe de Ville,"" ""The Exorcist III,"" ""Nightbreed,"" and ""Young Guns II."""
11207,2,what is the number of films directed by david s. ward?,98,2,203,"A12: David S. Ward directed two films: ""Major League"" and ""Major League II."""
12650,3,"after young guns, what was the next movie with the exact same budget?",98,Major League,203,"A13: After ""Young Guns,"" the next movie with the same budget of $11 million was ""The Exorcist III."""
13801,2,how many films did morgan creek make in 2006?,98,2,203,"A14: Morgan Creek made two films in 2006: ""The Good Shepherd"" and ""Man of the Year."""
668,3,what is the total number dallara chassis listed in the table?,99,5,203,"A1: The total number of Dallara chassis listed is 5 (from Edmonton IndyIndex 3, 4, 5, 6, 7)."
1456,3,which team won the champ car world series the year before rusport?,99,Newman/Haas Racing,203,A2: Newman/Haas Racing won the Champ Car World Series the year before RuSPORT (2005 season).
3237,3,how many times did sébastien bourdais win the champ car world series between 2005 and 2007?,99,2,203,"A3: Sébastien Bourdais won the Champ Car World Series three times between 2005 and 2007 (2005, 2006, 2007)."
4221,3,was the average speed in the year 2011 of the indycar series above or below the average speed of the year before?,99,below,203,A4: The average speed in 2011 (90.949 mph) was below the average speed of the year before (101.666 mph in 2010).
6057,3,how many different teams are represented in the table?,99,4,203,"A5: Four different teams are represented: Newman/Haas Racing, Chip Ganassi Racing, Penske Racing, RuSPORT."
7857,3,how many flags other than france (the first flag) are represented?,99,3,203,"A6: As there is no information given about flags or nationalities, this question cannot be answered from the provided information."
9163,3,what is the least amount of laps completed?,99,75,203,A7: The least amount of laps completed was 75 laps in Edmonton IndyIndex 7.
13002,3,how many total honda engines were there?,99,4,203,"A8: There were 5 Honda engines used (from Edmonton IndyIndex 3, 4, 5, 6, 7)."
128,3,"in 2008 in track and field events who broke more world records, usain bolt or haile gebrselassie?",102,Usain Bolt,203,Q1: Usain Bolt broke more world records.
526,3,in 2008 in track and field events how many world records did usain bolt break?,102,4,203,Q2: Usain Bolt broke three world records.
952,3,is the best time for the 100 m more or less than the time for the 110 m hurdles?,102,less,203,Q3: The best time for the 100 m (9.69 seconds) is less than the time for the 110 m hurdles (12.87 seconds).
1417,3,"which record is faster, 50km race walk or marathon",102,Marathon,203,Q4: The marathon record (2:03:59) is faster than the 50 km race walk (3:34:14).
2538,3,what country's 200 m was the quickest?,102,Jamaica,203,Q5: Jamaica's 200 m was the quickest.
3983,1,in 2008 in track and field events how long did it take for dayron robles to run the 110 m hurdles when he broke the world record.,102,12.87,203,Q6: Dayron Robles ran the 110 m hurdles in 12.87 seconds when he broke the world record.
4048,3,in how many places were the records made?,102,5,203,Q7: Records were made in six different places.
5638,3,what is the longest time on the table?,102,3:34:14,203,"Q8: The longest time on the table is 3 hours, 34 minutes, and 14 seconds for the 50 km race walk."
6091,3,what is last city in china to host world record,102,"Beijing, China",203,Q9: The last city in China to host a world record was Beijing.
7577,3,what is the number of countries listed in the table,102,4,203,"Q10: Four countries are listed in the table (Jamaica, Cuba, Russia, Ethiopia)."
8036,3,how many world records does ethiopia hold?,102,1,203,Q11: Ethiopia holds one world record.
8529,3,what is the number of world records that were recorded in august?,102,3,203,Q12: Three world records were recorded in August.
9436,1,who set consecutive world records in the 100m?,102,Usain Bolt,203,Q13: Usain Bolt set consecutive world records in the 100m.
9539,1,what is the average speed on each runner in the 4 x 100 m relay?,102,37.10,203,Q14: The average speed of each runner in the 4 x 100 m relay is approximately 10.73 m/s.
10288,3,how many records were set in beijing?,102,3,203,Q15: Three records were set in Beijing.
12702,3,which person set at least 2 world records?,102,Usain Bolt,203,Q16: Usain Bolt set at least two world records.
14,3,which athlete was from south korea after the year 2010?,104,Kim Yu-na,203,Q1: Kim Yu-na from South Korea competed in the Olympics from 2010 to 2014.
284,3,how many total medals has the united states won in women's figure skating?,104,16,203,Q2: The United States won a total of 11 medals in women's figure skating:- Carol Heiss: 1 gold 1 silver- Tenley Albright: 1 gold 1 silver- Michelle Kwan: 1 silver 1 bronze- Nancy Kerrigan: 1 silver 1 bronze- Beatrix Loughran: 2 silver 1 bronze
3169,1,how many silver medals did evgeni plushenko get?,104,2,203,Q3: Evgeni Plushenko won 2 silver medals.
3261,3,what was the greatest number of gold medals won by a single athlete?,104,3,203,Q4: The greatest number of gold medals won by a single athlete was 3 achieved by both Sonja Henie and Irina Rodnina with Alexander Zaitsev.
7018,3,how many more silver medals did gillis grafström have compared to sonja henie?,104,1,203,Q5: Gillis Grafström had 1 silver medal while Sonja Henie had no silver medals; therefore Grafström had 1 more silver medal than Henie.
8573,3,how many medals have sweden and norway won combined?,104,7,203,Q6: Sweden and Norway combined have won 9 medals:- Sweden (Gillis Grafström): 3 gold 1 silver- Norway (Sonja Henie): 3 gold
13431,3,which nation was the first to win three gold medals for olympic figure skating?,104,Sweden,203,Q7: Norway was the first nation to win three gold medals for Olympic figure skating achieved by Sonja Henie (1928 1932 1936).
711,2,which building has 8 floors and is 240 ft tall?,105,Industrial Exposition Building,203,A1: The Industrial Exposition Building has 8 floors and is 240 feet tall.
4309,2,how tall is it to the top of the ids tower in feet?,105,792,203,A2: The IDS Tower is 792 feet tall.
5642,1,which building has the same number of floors as the lumber exchange building?,105,Metropolitan Building,203,"A3: The Metropolitan Building has the same number of floors as the Lumber Exchange Building, which is 12."
8687,1,how many floors does the foshay tower have?,105,32,203,A4: The Foshay Tower has 32 floors.
8887,1,how long did the lumber exchange building stand as the tallest building?,105,1 year,203,A5: The Lumber Exchange Building was the tallest building for about 1 year.
9476,3,name the tallest building.,105,IDS Tower,203,A6: The IDS Center (IDS Tower) is the tallest building.
9903,1,is the metropolitan building or the lumber exchange building taller?,105,Metropolitan Building,203,A7: The Metropolitan Building is taller than the Lumber Exchange Building.
10812,3,what was the first building named as the tallest?,105,Globe Building,203,A8: The first building named as the tallest was The Globe Building.
11845,3,after ids tower what is the second tallest building in minneapolis?,105,Foshay Tower,203,"A9: The second tallest building in Minneapolis, after the IDS Tower, is the Foshay Tower."
13848,3,how many buildings on the list are taller than 200 feet?,105,5,203,"A10: Four buildings on the list are taller than 200 feet: Metropolitan Building, Minneapolis City Hall, Foshay Tower, and IDS Center."
1149,1,which 2 super middleweight champions both had the same about of successful defenses?,107,Joe Calzaghe|Sven Ottke,203,A1: Joe Calzaghe and Sven Ottke both had 21 successful defenses.
1887,3,what were the total amount of successful defenses andre ward had?,107,6,203,A2: Andre Ward had 6 successful defenses.
2881,3,what is the total number of title defenses completed by german champions?,107,27,203,"A3: Sven Ottke (21 defenses), Robert Stieglitz (6 defenses) - Total: 27 defenses."
3023,3,how long was the longest title reign?,107,"10 years, 11 months, 15 days",203,"A4: The longest title reign was 10 years, 11 months, and 15 days by Joe Calzaghe."
3251,3,what is the difference between the number of successful defenses by joe calzaghe and robert stieglitz?,107,15,203,A5: The difference is 15 successful defenses (Joe Calzaghe with 21 defenses and Robert Stieglitz with 6 defenses).
5735,3,who had the most successful defenses?,107,Joe Calzaghe|Sven Ottke,203,A6: Joe Calzaghe had the most successful defenses with 21.
6428,3,what is the number of times the title reign was longer than 3 years?,107,9,203,"A7: Seven times the title reign was longer than 3 years (Joe Calzaghe, Sven Ottke, Lucian Bute, Andre Ward, Nigel Benn, Chris Eubank, Frankie Liles)."
8156,3,what country does the least amount of successful defenses come from?,107,Denmark,203,A8: Denmark has the least amount of successful defenses (Mikkel Kessler with 4 defenses).
10918,1,who is the only champion to reign for more than 10 years?,107,Joe Calzaghe,203,A9: Joe Calzaghe is the only champion to reign for more than 10 years.
12886,3,what is the longest title reign after champion joe calzaghe?,107,"5 years, 5 months, 3 days",203,"A10: The longest title reign after Joe Calzaghe was 5 years, 5 months, and 3 days by Sven Ottke."
13244,3,how many champions had at least 10 title defenses?,107,4,203,"A11: Three champions had at least 10 title defenses (Joe Calzaghe, Sven Ottke, Chong-Pal Park)."
231,1,what year did monaco ratify more international human rights treaties than they did in 1979?,109,1993,203,"Q1: 1993 - In 1993, Morocco ratified five treaties: Convention on the Elimination of All Forms of Discrimination against Women, Convention against Torture and Other Cruel, Inhuman or Degrading Treatment or Punishment, Convention on the Rights of the Child, the International Convention on the Protection of the Rights of All Migrant Workers and Members of Their Families, and the International Convention for the Protection of All Persons from Enforced Disappearance."
1113,3,which was the first treaty in morocco to be ratified?,109,Convention on the Prevention and Punishment of the Crime of Genocide,203,Q2: The Convention on the Prevention and Punishment of the Crime of Genocide was the first treaty ratified by Morocco in 1958.
1818,3,"at most, how many international human rights treaties has monaco ratified in one year?",109,4,203,"Q3: In one year, Morocco ratified at most five international human rights treaties, which occurred in 1993."
3204,3,how many total international human rights treaties from the united nations has monaco ratified?,109,13,203,Q4: Morocco has ratified thirteen international human rights treaties from the United Nations.
6509,2,what is the only organization whose treaties morocco has signed?,109,United Nations,203,Q5: The United Nations is the only organization whose treaties Morocco has signed.
7339,2,how long did it take for the international covenant on civil and political rights to be signed before it was ratified?,109,11 years,203,"Q6: The International Covenant on Civil and Political Rights was signed in 1977 and ratified in 1979, taking 2 years between signing and ratification."
7410,3,which was the first human rights treaty to be signed?,109,International Convention on the Elimination of All Forms of Racial Discrimination,203,Q7: The first human rights treaty signed by Morocco was the International Convention on the Elimination of All Forms of Racial Discrimination in 1967.
10901,3,what is the last treaty morocco ratified?,109,International Convention for the Protection of All Persons from Enforced Disappearance,203,Q8: The last treaty Morocco ratified was the International Convention for the Protection of All Persons from Enforced Disappearance in 2013.
11047,3,how many treaties had been introduced by 1986?,109,9,203,"Q9: By 1986, nine treaties had been introduced that Morocco has interacted with, either by signing, ratifying, or both."
12140,3,what is the earliest treaty signed by morocco?,109,International Convention on the Elimination of All Forms of Racial Discrimination,203,Q10: The earliest treaty signed by Morocco was the International Convention on the Elimination of All Forms of Racial Discrimination in 1967.
1045,1,what country won the most medals in shooting at the 1988 summer olympics?,113,Soviet Union,203,A1: The Soviet Union (URS) won the most medals in shooting at the 1988 Summer Olympics with a total of 11 medals.
2512,3,which country was in the top of the 11 rank group?,113,Chile (CHI),203,A2: France Japan South Korea the United States Sweden and Chile were all tied in the 11th rank group each with 1 silver medal. There is no specific top country in this group as they all had equal ranking based on medal count.
3863,3,who were the top ranked countries in medal rank?,113,Soviet Union (URS)|Yugoslavia (YUG)|West Germany (FRG),203,"A3: The top-ranked countries in medal rank were:  - 1st: Soviet Union (URS) - 2nd: Yugoslavia (YUG)  - 3rd: West Germany (FRG)   - 4th: East Germany (GDR) Great Britain (GBR) Bulgaria (BUL) Czechoslovakia (TCH) each with a total of 2 medals."""
4410,1,which of these countries is ranked first?,113,Soviet Union (URS),203,A4: The Soviet Union (URS) is ranked first in terms of total medal count.
5027,1,who had more gold medals than the soviet union?,113,No one,203,A5: No country had more gold medals than the Soviet Union at the 1988 Summer Olympics in shooting.
8331,3,which of these countries was ranked next after yugoslavia?,113,West Germany (FRG),203,A6: West Germany (FRG) was ranked next after Yugoslavia holding the 3rd position.
13922,1,which country earned the most gold medals?,113,Soviet Union (URS),203,A7: The Soviet Union earned the most gold medals in shooting at the 1988 Summer Olympics with a total of 4 gold medals.
9,1,which players played the same position as ardo kreek?,116,Siim Ennemuist|Andri Aganits,203,"Q1: Siim Ennemuist and Andri Aganits both play the same position as Ardo Kreek, which is middle blocker."
1283,3,kert toobal is the oldest who is the next oldest player listed?,116,Argo Meresaar,203,"Q2: After Kert Toobal, Argo Meresaar is the next oldest player listed."
4750,3,which player is taller than andri agantis?,116,Oliver Venno,203,Q3: Oliver Venno (210 cm) is taller than Andri Aganits (207 cm).
7134,1,how much taller in oliver venno than rait rikberg?,116,36,203,Q4: Oliver Venno is 36 cm taller than Rait Rikberg (210 cm - 174 cm).
7730,3,who is at least 25 years or older?,116,Ardo Kreek|Kert Toobal|Martti Juhkami|Argo Meresaar|Rait Rikberg|Edgar Järvekülg|Jaanus Nõmmsalu,203,Q5: Players who are at least 25 years old or older are:  - Ardo Kreek  - Kert Toobal  - Robert Täht  - Oliver Venno   - Rait Rikberg   - Edgar Järvekülg  - Siim Ennemuist   - Jaanus Nõmmsalu   - Martti Juhkami   - Argo Meresaar
8659,3,how many players are middle blockers?,116,3,203,"Q6: There are three middle blockers: Ardo Kreek, Siim Ennemuist, and Andri Aganits."
12017,3,how many members of estonia's men's national volleyball team were born in 1988?,116,2,203,Q7: Two members of the team were born in 1988: Edgar Järvekülg and Martti Juhkami.
