index	#	Date	Venue	Opponent	Score	Result	Competition
0	1.0	16 November 2005	Tehelné pole, Bratislava, Slovakia	Spain	1–0	1–1	2006 FIFA World Cup play-offs
1	2.0	20 May 2006	Štadión Antona Malatinského, Trnava, Slovakia	Belgium	1–0	1–1	Friendly
3	4.0	21 November 2007	Stadio Olimpico, Serravalle, San Marino	San Marino	0–2	0–5	UEFA Euro 2008 qualifying
4	5.0	9 September 2009	Windsor Park, Belfast, Northern Ireland	Northern Ireland	0–2	0–2	2010 FIFA World Cup qualification
5	6.0	3 September 2010	Pasienky, Bratislava, Slovakia	Macedonia	1–0	1–0	UEFA Euro 2012 qualification
